{
  "schema_version": 1,
  "id": "00000000-0000-4000-8000-000000000330",
  "celebration": {
    "id": "00000000-0000-4000-8000-000000000331",
    "date": "2028-02-29",
    "title": "Ika-2 ng Linggo ng Pasko — Pagdiriwang ng Kapistahan ng Ginoo"
  },
  "package_version": {
    "id": "00000000-0000-4000-8000-000000000332",
    "fingerprint": "0db2a766904233144b834e675d1f4a6b1411df600926cfe3a69b2165f01048cd"
  },
  "snapshots": [
    {
      "schema_version": 1,
      "id": "00000000-0000-4000-8000-000000000333",
      "mass_plan_id": "00000000-0000-4000-8000-000000000334",
      "items": [
        {
          "id": "00000000-0000-4000-8000-000000000340",
          "title": "Bahagi 1 — Ñ ñ \"Awit\"",
          "asset_ids": []
        },
        {
          "id": "00000000-0000-4000-8000-000000000341",
          "title": "Bahagi 2 — Ñ ñ \"Awit\"",
          "asset_ids": []
        },
        {
          "id": "00000000-0000-4000-8000-000000000342",
          "title": "Bahagi 3 — Ñ ñ \"Awit\"",
          "asset_ids": []
        },
        {
          "id": "00000000-0000-4000-8000-000000000343",
          "title": "Bahagi 4 — Ñ ñ \"Awit\"",
          "asset_ids": []
        },
        {
          "id": "00000000-0000-4000-8000-000000000344",
          "title": "Bahagi 5 — Ñ ñ \"Awit\"",
          "asset_ids": []
        },
        {
          "id": "00000000-0000-4000-8000-000000000345",
          "title": "Bahagi 6 — Ñ ñ \"Awit\"",
          "asset_ids": []
        },
        {
          "id": "00000000-0000-4000-8000-000000000346",
          "title": "Bahagi 7 — Ñ ñ \"Awit\"",
          "asset_ids": []
        },
        {
          "id": "00000000-0000-4000-8000-000000000347",
          "title": "Bahagi 8 — Ñ ñ \"Awit\"",
          "asset_ids": []
        },
        {
          "id": "00000000-0000-4000-8000-000000000348",
          "title": "Bahagi 9 — Ñ ñ \"Awit\"",
          "asset_ids": []
        },
        {
          "id": "00000000-0000-4000-8000-000000000349",
          "title": "Bahagi 10 — Ñ ñ \"Awit\"",
          "asset_ids": []
        },
        {
          "id": "00000000-0000-4000-8000-000000000350",
          "title": "Bahagi 11 — Ñ ñ \"Awit\"",
          "asset_ids": []
        },
        {
          "id": "00000000-0000-4000-8000-000000000351",
          "title": "Bahagi 12 — Ñ ñ \"Awit\"",
          "asset_ids": []
        },
        {
          "id": "00000000-0000-4000-8000-000000000352",
          "title": "Bahagi 13 — Ñ ñ \"Awit\"",
          "asset_ids": []
        },
        {
          "id": "00000000-0000-4000-8000-000000000353",
          "title": "Bahagi 14 — Ñ ñ \"Awit\"",
          "asset_ids": []
        },
        {
          "id": "00000000-0000-4000-8000-000000000354",
          "title": "Bahagi 15 — Ñ ñ \"Awit\"",
          "asset_ids": []
        },
        {
          "id": "00000000-0000-4000-8000-000000000355",
          "title": "Bahagi 16 — Ñ ñ \"Awit\"",
          "asset_ids": []
        },
        {
          "id": "00000000-0000-4000-8000-000000000356",
          "title": "Bahagi 17 — Ñ ñ \"Awit\"",
          "asset_ids": []
        },
        {
          "id": "00000000-0000-4000-8000-000000000357",
          "title": "Bahagi 18 — Ñ ñ \"Awit\"",
          "asset_ids": []
        },
        {
          "id": "00000000-0000-4000-8000-000000000358",
          "title": "Bahagi 19 — Ñ ñ \"Awit\"",
          "asset_ids": []
        },
        {
          "id": "00000000-0000-4000-8000-000000000359",
          "title": "Bahagi 20 — Ñ ñ \"Awit\"",
          "asset_ids": []
        }
      ],
      "assets": [],
      "assets_fingerprint": "e3b0c44298fc1c149afbf4c8996fb92427ae41e4649b934ca495991b7852b855"
    }
  ],
  "assets": []
}
